ordinal,item,itemLabel,inception,inceptionPrecision,startTime,startTimePrecision,abolished,abolishedPrecision,endTime,endTimePrecision,replaces,replacesLabel,replacedBy,replacedByLabel,follows,followsLabel,followedBy,followedByLabel
,Q3112094,Hama Amadou's Cabinet I,2000-01-05,11,,,2001-09-17,11,,,,,Q3112095,Hama Amadou's Cabinet II,,,,
,Q3112095,Hama Amadou's Cabinet II,2000-01-05,11,,,2001-09-17,11,,,Q3112094,Hama Amadou's Cabinet I,Q3112097,Hama Amadou's Cabinet III,,,,
,Q3112097,Hama Amadou's Cabinet III,2002-11-09,11,,,2004-12-30,11,,,Q3112095,Hama Amadou's Cabinet II,Q3112098,Hama Amadou's Cabinet IV,,,,
,Q3112098,Hama Amadou's Cabinet IV,2004-12-30,11,,,2007-05-31,11,,,Q3112097,Hama Amadou's Cabinet III,Q3112336,Seyni Oumarou's Cabinet,,,,
,Q3112336,Seyni Oumarou's Cabinet,2007-06-09,11,,,2010-02-17,11,,,Q3112098,Hama Amadou's Cabinet IV,Q3111988,Mahamadou Ganda's Cabinet,,,,
,Q3111988,Mahamadou Ganda's Cabinet,2010-03-01,11,,,2011-09-12,11,,,Q3112336,Seyni Oumarou's Cabinet,Q2376805,Brigi Rafini's Cabinet,,,,
,Q2376805,Brigi Rafini's Cabinet,2011-09-12,11,,,2021-04-03,11,,,Q3111988,Mahamadou Ganda's Cabinet,Q109037622,Mahamadou Cabinet,,,,
,Q109037622,Mahamadou Cabinet,2021-04-07,11,,,,,,,Q2376805,Brigi Rafini's Cabinet,,,,,,
